{
  "reportVersion": "1",
  "kind": "suite",
  "generatedAt": "2026-10-07T15:20:50.335Z",
  "command": "node dist/cli.js suite --backend testnet --out docs/evidence/suite-testnet.json --text-out docs/evidence/suite-testnet.txt",
  "environment": {
    "node": "v24.19.0",
    "platform": "linux",
    "arch": "x64",
    "chargeguardRunner": "0.1.0",
    "sdk": {
      "@stellar/mpp": "0.7.1",
      "mppx": "0.6.31",
      "@stellar/stellar-sdk": "15.1.0"
    }
  },
  "evidenceClass": "testnet settlement",
  "reports": [
    {
      "reportVersion": "1",
      "kind": "run",
      "generatedAt": "2026-10-07T15:18:33.743Z",
      "command": "node dist/cli.js suite --backend testnet --out docs/evidence/suite-testnet.json --text-out docs/evidence/suite-testnet.txt",
      "environment": {
        "node": "v24.19.0",
        "platform": "linux",
        "arch": "x64",
        "chargeguardRunner": "0.1.0",
        "sdk": {
          "@stellar/mpp": "0.7.1",
          "mppx": "0.6.31",
          "@stellar/stellar-sdk": "15.1.0"
        }
      },
      "evidenceClass": "testnet settlement",
      "chain": {
        "kind": "testnet",
        "description": "Stellar testnet via a logging pass-through to https://soroban-testnet.stellar.org"
      },
      "deployment": {
        "workers": 2,
        "store": "memory",
        "mode": "push"
      },
      "scenario": {
        "id": "repeated-credential",
        "variant": null,
        "title": "Repeated credential across workers",
        "invariant": "A credential that one worker accepted is not accepted by the other worker, and the paid resource is delivered once.",
        "faultSchedule": [
          "Start worker-a and worker-b, each a separate OS process, store memory (one private map per process).",
          "Obtain one challenge and build one push-mode credential with the official client.",
          "Present the credential to worker-a, then the identical credential to worker-b, then to worker-a again."
        ]
      },
      "expectation": "fail",
      "verdict": "fail",
      "matchesExpectation": true,
      "summary": "4 of 5 checks failed: single-acceptance, store-level-protection, single-fulfillment, single-fulfillment-per-challenge.",
      "checks": [
        {
          "id": "first-presentation-accepted",
          "description": "The first presentation is accepted (otherwise the run proves nothing).",
          "passed": true,
          "detail": "worker-a answered 200."
        },
        {
          "id": "single-acceptance",
          "description": "At most one response across both workers accepts the credential.",
          "passed": false,
          "detail": "2 of 3 presentations were accepted (200, 200, 402)."
        },
        {
          "id": "store-level-protection",
          "description": "The replay is stopped by the store before any second transaction reaches the chain, not only by the ledger's sequence rule.",
          "passed": false,
          "detail": "push mode: the chain cannot refuse a repeated hash, so the store is the only defence; 2 acceptances."
        },
        {
          "id": "single-fulfillment",
          "description": "Each payment is delivered at most once (counted from the workers' fulfillment logs).",
          "passed": false,
          "detail": "payment-1 delivered 2 times."
        },
        {
          "id": "single-fulfillment-per-challenge",
          "description": "Each challenge is delivered against at most once.",
          "passed": false,
          "detail": "challenge TA9H94FprX… delivered 2 times"
        },
        {
          "id": "evidence-consistent",
          "description": "Client-observed responses match the workers' own request and fulfillment logs.",
          "passed": true,
          "detail": "client saw 4 responses (2 accepted); workers logged 4 requests (2 accepted) and 2 fulfillments."
        }
      ],
      "observations": [],
      "payments": [
        {
          "id": "payment-1",
          "mode": "push",
          "txHash": "0af93397671e3c43fb105cac127d931911bc54ceb8680e11cb75f1d95bfaa542",
          "challengeId": "TA9H94FprXLfNkQLWzyFz5oiTnXTWZ6XtqGxmZKFCxw",
          "levels": {
            "accepted": 2,
            "submitted": "client",
            "confirmed": "SUCCESS",
            "fulfilled": 2
          },
          "note": "2 worker responses accepted the credential; the transaction was submitted by the client; chain: SUCCESS; the resource was delivered 2 times. One payment bought more than one delivery."
        }
      ],
      "broadcasts": [
        {
          "t": 3131,
          "paymentId": "payment-1",
          "txHash": "0af93397671e3c43fb105cac127d931911bc54ceb8680e11cb75f1d95bfaa542",
          "outcome": "PENDING",
          "resultCode": null
        }
      ],
      "timeline": [
        {
          "t": 2122,
          "durationMs": 32,
          "worker": "worker-a",
          "label": "payment: request challenge from worker-a",
          "request": "challenge",
          "status": 402,
          "outcome": "challenge",
          "paymentId": null,
          "detail": "Payment is required (ChargeGuard reference resource)."
        },
        {
          "t": 7567,
          "durationMs": 317,
          "worker": "worker-a",
          "label": "first presentation: present payment-1 to worker-a",
          "request": "credential",
          "status": 200,
          "outcome": "accepted",
          "paymentId": "payment-1",
          "detail": null
        },
        {
          "t": 7884,
          "durationMs": 307,
          "worker": "worker-b",
          "label": "replay to the other worker: present payment-1 to worker-b",
          "request": "credential",
          "status": 200,
          "outcome": "accepted",
          "paymentId": "payment-1",
          "detail": null
        },
        {
          "t": 8191,
          "durationMs": 6,
          "worker": "worker-a",
          "label": "replay to the first worker: present payment-1 to worker-a",
          "request": "credential",
          "status": 402,
          "outcome": "rejected",
          "paymentId": "payment-1",
          "detail": "Payment verification failed."
        }
      ],
      "faultEvents": [
        {
          "t": 1070,
          "kind": "worker-start",
          "detail": "worker-a started as pid 452031 with store memory"
        },
        {
          "t": 2120,
          "kind": "worker-start",
          "detail": "worker-b started as pid 452039 with store memory"
        },
        {
          "t": 7567,
          "kind": "client-paid",
          "detail": "payer broadcast and confirmed transaction 0af93397671e… itself (push)"
        }
      ],
      "limits": [
        "A finite number of runs is evidence, not a proof: this report does not show linearizability or exactly-once delivery.",
        "Only the two-worker reference deployment shape of this runner was exercised, not your own server code.",
        "Payment channels are out of scope.",
        "Testnet is a shared network with its own latency; a run shows what happened once."
      ]
    },
    {
      "reportVersion": "1",
      "kind": "run",
      "generatedAt": "2026-10-07T15:18:43.743Z",
      "command": "node dist/cli.js suite --backend testnet --out docs/evidence/suite-testnet.json --text-out docs/evidence/suite-testnet.txt",
      "environment": {
        "node": "v24.19.0",
        "platform": "linux",
        "arch": "x64",
        "chargeguardRunner": "0.1.0",
        "sdk": {
          "@stellar/mpp": "0.7.1",
          "mppx": "0.6.31",
          "@stellar/stellar-sdk": "15.1.0"
        }
      },
      "evidenceClass": "testnet settlement",
      "chain": {
        "kind": "testnet",
        "description": "Stellar testnet via a logging pass-through to https://soroban-testnet.stellar.org"
      },
      "deployment": {
        "workers": 2,
        "store": "sqlite",
        "mode": "push"
      },
      "scenario": {
        "id": "repeated-credential",
        "variant": null,
        "title": "Repeated credential across workers",
        "invariant": "A credential that one worker accepted is not accepted by the other worker, and the paid resource is delivered once.",
        "faultSchedule": [
          "Start worker-a and worker-b, each a separate OS process, store sqlite (one shared file).",
          "Obtain one challenge and build one push-mode credential with the official client.",
          "Present the credential to worker-a, then the identical credential to worker-b, then to worker-a again."
        ]
      },
      "expectation": "pass",
      "verdict": "pass",
      "matchesExpectation": true,
      "summary": "All 5 checks passed.",
      "checks": [
        {
          "id": "first-presentation-accepted",
          "description": "The first presentation is accepted (otherwise the run proves nothing).",
          "passed": true,
          "detail": "worker-a answered 200."
        },
        {
          "id": "single-acceptance",
          "description": "At most one response across both workers accepts the credential.",
          "passed": true,
          "detail": "1 of 3 presentations were accepted (200, 402, 402)."
        },
        {
          "id": "store-level-protection",
          "description": "The replay is stopped by the store before any second transaction reaches the chain, not only by the ledger's sequence rule.",
          "passed": true,
          "detail": "push mode: the chain cannot refuse a repeated hash, so the store is the only defence; 1 acceptance."
        },
        {
          "id": "single-fulfillment",
          "description": "Each payment is delivered at most once (counted from the workers' fulfillment logs).",
          "passed": true,
          "detail": "max deliveries per payment: 1."
        },
        {
          "id": "single-fulfillment-per-challenge",